{"analysis_graph_ref":{"byte_count":1173,"media_type":"application/json","relative_path":"inputs/analysis-graph.json","role":"analysis","sha256":"aa4310584d605928e2edcba0828381c97f4aab0e51f115569073b9e22f4a44e4"},"assignment_ref":{"byte_count":664,"media_type":"application/json","relative_path":"inputs/assignment-pending.json","role":"assignment","sha256":"62a2c1bf460f25b13126ceb9eac19cb885294fe8eec2a06860763d1fd9a275fd"},"authorizing":false,"benchmark_adapter_ref":{"byte_count":805,"media_type":"application/json","relative_path":"inputs/benchmark-adapter-manifest.json","role":"adapter","sha256":"479e5a874e72be2cec096459a11dfe87fdd3f8210213595667d59eb7daacd7f2"},"input_lock_ref":{"byte_count":2993,"media_type":"application/json","relative_path":"inputs/input-lock.json","role":"input_lock","sha256":"7bb584da29f1fb55e5f46133a985bd3c249f154643dad5a3469ae737aee497e7"},"provider_binding_ref":{"byte_count":1087,"media_type":"application/json","relative_path":"inputs/provider-binding.json","role":"provider","sha256":"f3fceeea6678d48e428ebe8cb19b1ae72859d81b597bc83f2a2eba1fe1cf6154"},"record_kind":"cloud_official_input_package","rng_ref":{"byte_count":770,"media_type":"application/json","relative_path":"inputs/rng-commitment.json","role":"rng","sha256":"bc70bcae9e4d2727e176767100d54ad48dc901bded29e5a27da07f8674975e24"},"roster_ref":{"byte_count":1361,"media_type":"application/json","relative_path":"inputs/roster-candidate.json","role":"roster","sha256":"215bd2e7acb352c8d1c0c79dbd4863176fc689b7c450a4afaffcc30bf2e119c6"},"run_spec_candidate_ref":{"byte_count":5460,"media_type":"application/json","relative_path":"run-spec-candidate.json","role":"run_spec_candidate","sha256":"028c39c4e44cf66438df528b64ba73209e49205266e156dfcfbe506b60aa5760"},"schema_version":"0.1.0","status":"pre_launch_candidate","study_id":"neurips-2026-resampling-null","task_manifest_ref":{"byte_count":49286,"media_type":"application/json","relative_path":"inputs/task-registry.json","role":"task_manifest","sha256":"03ae3f651c0c54380237fb0ff9b929a130c650725a095b4520f0b0a1c714c74a"}}
